{
  "schema_version": 1,
  "registry_id": "technical-implementation-primary-sources",
  "as_of": "2026-10-04",
  "sources": [
    {
      "source_id": "redhat-rhel7-docs",
      "vendor": "Red Hat",
      "product": "Red Hat Enterprise Linux 7",
      "domain": "rhel",
      "title": "RHEL 7 product documentation",
      "canonical_url": "https://docs.redhat.com/en/documentation/red_hat_enterprise_linux/7",
      "source_authority": "vendor-primary",
      "access_class": "public-anonymous",
      "redistribution_class": "manual-license-review",
      "default_classification": "private",
      "acquisition_mode": "public-web",
      "version_strategy": "Acquire individual guides with their legal notice and exact publication version.",
      "applicability": "RHEL 7 only; preserve minor-release and ELS boundaries.",
      "parser_hint": "HTML/PDF by heading and page; retain commands with surrounding warnings.",
      "refresh_cadence": "Quarterly and before a RHEL 7 change.",
      "status": "active",
      "notes": "Keep entitled knowledgebase articles as separate authenticated sources."
    },
    {
      "source_id": "redhat-rhel8-docs",
      "vendor": "Red Hat",
      "product": "Red Hat Enterprise Linux 8",
      "domain": "rhel",
      "title": "RHEL 8 product documentation",
      "canonical_url": "https://docs.redhat.com/en/documentation/red_hat_enterprise_linux/8",
      "source_authority": "vendor-primary",
      "access_class": "public-anonymous",
      "redistribution_class": "manual-license-review",
      "default_classification": "private",
      "acquisition_mode": "public-web",
      "version_strategy": "Acquire release-specific guides and record the legal notice for each.",
      "applicability": "RHEL 8; retain minor release, EUS, architecture, and component version.",
      "parser_hint": "HTML/PDF by heading and page.",
      "refresh_cadence": "Monthly and before platform changes.",
      "status": "active",
      "notes": ""
    },
    {
      "source_id": "redhat-rhel9-docs",
      "vendor": "Red Hat",
      "product": "Red Hat Enterprise Linux 9",
      "domain": "rhel",
      "title": "RHEL 9 product documentation",
      "canonical_url": "https://docs.redhat.com/en/documentation/red_hat_enterprise_linux/9",
      "source_authority": "vendor-primary",
      "access_class": "public-anonymous",
      "redistribution_class": "manual-license-review",
      "default_classification": "private",
      "acquisition_mode": "public-web",
      "version_strategy": "Acquire release-specific guides and record the legal notice for each.",
      "applicability": "RHEL 9; retain minor release, EUS, architecture, kernel, and component version.",
      "parser_hint": "HTML/PDF by heading and page.",
      "refresh_cadence": "Monthly and before platform changes.",
      "status": "active",
      "notes": ""
    },
    {
      "source_id": "redhat-rhel10-docs",
      "vendor": "Red Hat",
      "product": "Red Hat Enterprise Linux 10",
      "domain": "rhel",
      "title": "RHEL 10 product documentation",
      "canonical_url": "https://docs.redhat.com/en/documentation/red_hat_enterprise_linux/10",
      "source_authority": "vendor-primary",
      "access_class": "public-anonymous",
      "redistribution_class": "manual-license-review",
      "default_classification": "private",
      "acquisition_mode": "public-web",
      "version_strategy": "Acquire release-specific guides; model DNF 5, image mode, and Extensions separately.",
      "applicability": "RHEL 10 only; do not transpose RHEL 8/9 procedures.",
      "parser_hint": "HTML/PDF by heading and page.",
      "refresh_cadence": "Monthly and before platform changes.",
      "status": "active",
      "notes": ""
    },
    {
      "source_id": "redhat-rhel-lifecycle",
      "vendor": "Red Hat",
      "product": "Red Hat Enterprise Linux",
      "domain": "rhel",
      "title": "RHEL life cycle",
      "canonical_url": "https://access.redhat.com/support/policy/updates/errata",
      "source_authority": "vendor-primary",
      "access_class": "public-anonymous",
      "redistribution_class": "metadata-only-public",
      "default_classification": "private",
      "acquisition_mode": "public-web",
      "version_strategy": "Snapshot effective-dated lifecycle tables; never overwrite historical applicability.",
      "applicability": "All operated RHEL major/minor releases.",
      "parser_hint": "Normalize lifecycle phases and dates into compatibility facts.",
      "refresh_cadence": "Monthly and before support or procurement decisions.",
      "status": "active",
      "notes": ""
    },
    {
      "source_id": "redhat-security-data",
      "vendor": "Red Hat",
      "product": "Red Hat Product Security",
      "domain": "security",
      "title": "Red Hat Security Data",
      "canonical_url": "https://access.redhat.com/security/data",
      "source_authority": "vendor-security",
      "access_class": "public-anonymous",
      "redistribution_class": "public-with-attribution",
      "default_classification": "private",
      "acquisition_mode": "public-web",
      "version_strategy": "Preserve upstream schema version, advisory revision, and retrieval date.",
      "applicability": "Red Hat products installed in the environment.",
      "parser_hint": "Prefer CSAF, OVAL, CVE, and other structured feeds.",
      "refresh_cadence": "Daily or weekly.",
      "status": "active",
      "notes": "Verify the license notice attached to each feed."
    },
    {
      "source_id": "nvidia-driver-install-guide",
      "vendor": "NVIDIA",
      "product": "NVIDIA Driver",
      "domain": "nvidia",
      "title": "NVIDIA Driver Installation Guide",
      "canonical_url": "https://docs.nvidia.com/datacenter/tesla/driver-installation-guide/latest/",
      "source_authority": "vendor-primary",
      "access_class": "public-anonymous",
      "redistribution_class": "metadata-only-public",
      "default_classification": "private",
      "acquisition_mode": "public-web",
      "version_strategy": "Acquire current and branch-specific guide versions.",
      "applicability": "NVIDIA drivers; preserve distribution, branch, architecture, and module flavor.",
      "parser_hint": "HTML by section anchor; extract distro tables and warnings.",
      "refresh_cadence": "Weekly and before driver media builds.",
      "status": "active",
      "notes": ""
    },
    {
      "source_id": "nvidia-kernel-modules",
      "vendor": "NVIDIA",
      "product": "NVIDIA Open GPU Kernel Modules",
      "domain": "nvidia",
      "title": "Kernel module flavor selection",
      "canonical_url": "https://docs.nvidia.com/datacenter/tesla/driver-installation-guide/kernel-modules.html",
      "source_authority": "vendor-primary",
      "access_class": "public-anonymous",
      "redistribution_class": "metadata-only-public",
      "default_classification": "private",
      "acquisition_mode": "public-web",
      "version_strategy": "Capture module-flavor requirements and branch-specific commands with retrieval date.",
      "applicability": "GPU architecture, driver branch, distribution, and kernel-module flavor.",
      "parser_hint": "Normalize support rules and exact stream names.",
      "refresh_cadence": "Weekly and before driver selection.",
      "status": "active",
      "notes": "Blackwell and later require Open kernel modules."
    },
    {
      "source_id": "nvidia-rhel-install",
      "vendor": "NVIDIA",
      "product": "NVIDIA Driver on RHEL",
      "domain": "nvidia",
      "title": "Red Hat Enterprise Linux installation procedure",
      "canonical_url": "https://docs.nvidia.com/datacenter/tesla/driver-installation-guide/615/red-hat-enterprise-linux.html",
      "source_authority": "vendor-primary",
      "access_class": "public-anonymous",
      "redistribution_class": "metadata-only-public",
      "default_classification": "private",
      "acquisition_mode": "public-web",
      "version_strategy": "Acquire the latest guide and preserve RHEL-major-specific sections.",
      "applicability": "RHEL 8/9/10; procedures differ by major release.",
      "parser_hint": "Extract prerequisites, module streams, package profiles, RHEL 10 Extensions path, and versionlock guidance.",
      "refresh_cadence": "Weekly and before builds.",
      "status": "active",
      "notes": ""
    },
    {
      "source_id": "nvidia-driver-lifecycle",
      "vendor": "NVIDIA",
      "product": "NVIDIA Data Center Driver",
      "domain": "nvidia",
      "title": "Driver lifecycle",
      "canonical_url": "https://docs.nvidia.com/datacenter/tesla/drivers/latest/driver-lifecycle.html",
      "source_authority": "vendor-primary",
      "access_class": "public-anonymous",
      "redistribution_class": "metadata-only-public",
      "default_classification": "private",
      "acquisition_mode": "public-web",
      "version_strategy": "Store effective-dated branch lifecycle records.",
      "applicability": "Driver branch and deployment class.",
      "parser_hint": "Normalize branch, support type, start, end, and supersession.",
      "refresh_cadence": "Monthly and before branch selection.",
      "status": "active",
      "notes": ""
    },
    {
      "source_id": "nvidia-r580-17804-release-notes",
      "vendor": "NVIDIA",
      "product": "NVIDIA Data Center Driver R580",
      "domain": "nvidia",
      "title": "NVIDIA Linux Driver 580.178.04 release notes",
      "canonical_url": "https://docs.nvidia.com/datacenter/tesla/tesla-release-notes-580-178-04/index.html",
      "source_authority": "vendor-primary",
      "access_class": "public-anonymous",
      "redistribution_class": "metadata-only-public",
      "default_classification": "private",
      "acquisition_mode": "public-web",
      "version_strategy": "Freeze the exact release notes and add separate records for later R580 releases.",
      "applicability": "Driver 580.178.04, listed GPUs, operating systems, known issues, and API support.",